"Name","Description"
"api-fuzzing-for-bug-bounty","API Fuzzing for Bug Bounty"
"app-store-screenshots","App Store and Google Play screenshot creation with exact platform specs. Covers iOS/Android dimensions, gallery ordering, device mockups, and preview videos. Use for: app store optimization, ASO, app screenshots, app preview, play store listing. Triggers: app store screenshots, aso, app store optimization, play store screenshots, app preview, app listing, ios screenshots, android screenshots, app store images, app mockup, device mockup, app gallery, store listing"
"app-store-screenshots","App Store and Google Play screenshot creation with exact platform specs. Covers iOS/Android dimensions, gallery ordering, device mockups, and preview videos. Use for: app store optimization, ASO, app screenshots, app preview, play store listing. Triggers: app store screenshots, aso, app store optimization, play store screenshots, app preview, app listing, ios screenshots, android screenshots, app store images, app mockup, device mockup, app gallery, store listing"
"architect-review","Use this skill when"
"cicd-automation-workflow-automate","You are a workflow automation expert specializing in creating efficient CI/CD pipelines, GitHub Actions workflows, and automated development processes. Design automation that reduces manual work, improves consistency, and accelerates delivery while maintaining quality and security."
"clarity-gate","Pre-ingestion verification for epistemic quality in RAG systems with 9-point verification and Two-Round HITL workflow"
"clean-code","Applies principles from Robert C. Martin's 'Clean Code'. Use this skill when writing, reviewing, or refactoring code to ensure high quality, readability, and maintainability. Covers naming, functions, comments, error handling, and class design."
"code-refactoring","Code Refactoring"
"code-refactoring-context-restore","Use when working with code refactoring context restore"
"code-refactoring-refactor-clean","You are a code refactoring expert specializing in clean code principles, SOLID design patterns, and modern software engineering best practices. Analyze and refactor the provided code to improve its quality, maintainability, and performance."
"code-refactoring-tech-debt","You are a technical debt expert specializing in identifying, quantifying, and prioritizing technical debt in software projects. Analyze the codebase to uncover debt, assess its impact, and create acti"
"code-review","Code Review"
"code-review-ai-ai-review","You are an expert AI-powered code review specialist combining automated static analysis, intelligent pattern recognition, and modern DevOps practices. Leverage AI tools (GitHub Copilot, Qodo, GPT-5, C"
"code-review-checklist","Comprehensive checklist for conducting thorough code reviews covering functionality, security, performance, and maintainability"
"code-review-excellence","Code Review Excellence"
"code-reviewer","Use this skill when"
"codebase-cleanup-refactor-clean","You are a code refactoring expert specializing in clean code principles, SOLID design patterns, and modern software engineering best practices. Analyze and refactor the provided code to improve its quality, maintainability, and performance."
"codex-review","codex-review"
"competitor-teardown","Structured competitive analysis with feature matrices, SWOT, positioning maps, and UX review. Covers research frameworks, pricing comparison, review mining, and visual deliverables. Use for: market research, competitive intelligence, investor decks, product strategy, sales enablement. Triggers: competitor analysis, competitive analysis, competitor teardown, market research, competitive intelligence, swot analysis, competitor comparison, market landscape, competitor review, competitive landscape, feature comparison, market positioning"
"competitor-teardown","Structured competitive analysis with feature matrices, SWOT, positioning maps, and UX review. Covers research frameworks, pricing comparison, review mining, and visual deliverables. Use for: market research, competitive intelligence, investor decks, product strategy, sales enablement. Triggers: competitor analysis, competitive analysis, competitor teardown, market research, competitive intelligence, swot analysis, competitor comparison, market landscape, competitor review, competitive landscape, feature comparison, market positioning"
"comprehensive-review-full-review","Use when working with comprehensive review full review"
"comprehensive-review-pr-enhance","You are a PR optimization expert specializing in creating high-quality pull requests that facilitate efficient code reviews. Generate comprehensive PR descriptions, automate review processes, and ensure PRs follow best practices for clarity, size, and reviewability."
"copy-editing","When the user wants to edit, review, or improve existing marketing copy. Also use when the user mentions 'edit this copy,' 'review my copy,' 'copy feedback,' 'proofread,' 'polish this,' 'make this better,' or 'copy sweep.' This skill provides a systematic approach to editing marketing copy through multiple focused passes."
"create-agentsmd","Create high‑quality AGENTS.md file"
"create-pr","Create pull requests following Sentry conventions. Use when opening PRs, writing PR descriptions, or preparing changes for review. Follows Sentry's code review guidelines."
"creating-oracle-to-postgres-migration-bug-report","Creating Bug Reports for Oracle-to-PostgreSQL Migration"
"data-intelligence-forge","ELITE data intelligence — fusion of 22 data/DB/search skills. Covers data engineering, data science, visualization, quality, pipelines, database architecture, SQL optimization, embeddings, vector search, RAG, hybrid search, and similarity patterns."
"data-quality-frameworks","Data Quality Frameworks"
"debugger","Debugger"
"debugger","Use this skill when"
"debugging","Debugging"
"debugging-strategies","Debugging Strategies"
"debugging-toolkit-smart-debug","Use when working with debugging toolkit smart debug"
"deep-research","Execute autonomous multi-step research using Google Gemini Deep Research Agent. Use for: market analysis, competitive landscaping, literature reviews, technical research, due diligence. Takes 2-10 minutes but produces detailed, cited reports. Costs $2-5 per task."
"distributed-debugging-debug-trace","You are a debugging expert specializing in setting up comprehensive debugging environments, distributed tracing, and diagnostic tools. Configure debugging workflows, implement tracing solutions, and establish troubleshooting practices for development and production environments."
"dotnet-design-pattern-review",".NET/C# Design Pattern Review"
"error-debugging-error-analysis","You are an expert error analysis specialist with deep expertise in debugging distributed systems, analyzing production incidents, and implementing comprehensive observability solutions."
"error-debugging-error-trace","You are an error tracking and observability expert specializing in implementing comprehensive error monitoring solutions. Set up error tracking systems, configure alerts, implement structured logging, and ensure teams can quickly identify and resolve production issues."
"error-debugging-multi-agent-review","Use when working with error debugging multi agent review"
"error-debugging-nexus","ELITE error handling & debugging — fusion of 17 error/debug/incident skills. Covers error handling patterns, detective work, error analysis, error tracing, multi-agent review, smart debugging, diagnostics, debugging strategies, systematic debugging, Python errors, bug finding, and incident response."
"error-diagnostics-error-analysis","You are an expert error analysis specialist with deep expertise in debugging distributed systems, analyzing production incidents, and implementing comprehensive observability solutions."
"error-diagnostics-smart-debug","Use when working with error diagnostics smart debug"
"find-bugs","Find bugs, security vulnerabilities, and code quality issues in local branch changes. Use when asked to review changes, find bugs, security review, or audit code on the current branch."
"fix-review","Verify fix commits address audit findings without new bugs"
"flowstudio-power-automate-debug","Power Automate Debugging with FlowStudio MCP"
"git-pr-workflows-pr-enhance","You are a PR optimization expert specializing in creating high-quality pull requests that facilitate efficient code reviews. Generate comprehensive PR descriptions, automate review processes, and ensu"
"github-automation","Automate GitHub repositories, issues, pull requests, branches, CI/CD, and permissions via Rube MCP (Composio). Manage code workflows, review PRs, search code, and handle deployments programmatically."
"github-workflow-automation","Automate GitHub workflows with AI assistance. Includes PR reviews, issue triage, CI/CD integration, and Git operations. Use when automating GitHub workflows, setting up PR review automation, creating GitHub Actions, or triaging issues."
"google-veo","Generate videos with Google Veo models via inference.sh CLI. Models: Veo 3.1, Veo 3.1 Fast, Veo 3, Veo 3 Fast, Veo 2. Capabilities: text-to-video, cinematic output, high quality video generation. Triggers: veo, google veo, veo 3, veo 2, veo 3.1, vertex ai video, google video generation, google video ai, veo model, veo video"
"google-veo","Generate videos with Google Veo models via inference.sh CLI. Models: Veo 3.1, Veo 3.1 Fast, Veo 3, Veo 3 Fast, Veo 2. Capabilities: text-to-video, cinematic output, high quality video generation. Triggers: veo, google veo, veo 3, veo 2, veo 3.1, vertex ai video, google video generation, google video ai, veo model, veo video"
"incident-response-smart-fix","[Extended thinking: This workflow implements a sophisticated debugging and resolution pipeline that leverages AI-assisted debugging tools and observability platforms to systematically diagnose and res"
"intent-framed-agent","Frames coding-agent work sessions with explicit intent capture and drift monitoring. Use when a session transitions from planning/Q&A to implementation for coding tasks, refactors, feature builds, bug fixes, or other multi-step execution where scope drift is a risk."
"iterate-pr","Iterate on a PR until CI passes. Use when you need to fix CI failures, address review feedback, or continuously push fixes until all checks are green. Automates the feedback-fix-push-wait cycle."
"java-refactoring-extract-method","Refactoring Java Methods with Extract Method"
"java-refactoring-remove-parameter","Refactoring Java Methods with Remove Parameter"
"javascript-mastery","Comprehensive JavaScript reference covering 33+ essential concepts every developer should know. From fundamentals like primitives and closures to advanced patterns like async/await and functional programming. Use when explaining JS concepts, debugging JavaScript issues, or teaching JavaScript fundamentals."
"langfuse","Expert in Langfuse - the open-source LLM observability platform. Covers tracing, prompt management, evaluation, datasets, and integration with LangChain, LlamaIndex, and OpenAI. Essential for debugging, monitoring, and improving LLM applications in production. Use when: langfuse, llm observability, llm tracing, prompt management, llm evaluation."
"lint-and-validate","Automatic quality control, linting, and static analysis procedures. Use after every code modification to ensure syntax correctness and project standards. Triggers onKeywords: lint, format, check, validate, types, static analysis."
"multi-agent-brainstorming","Multi-Agent Brainstorming (Structured Design Review)"
"multi-reviewer-patterns","Multi-Reviewer Patterns"
"nano-banana-2","Generate images with Google Gemini 3.1 Flash Image Preview (Nano Banana 2) via inference.sh CLI. Capabilities: text-to-image, image editing, multi-image input (up to 14 images), Google Search grounding. Triggers: nano banana 2, nanobanana 2, gemini 3.1 flash image, gemini 3 1 flash image preview, google image generation"
"observe-whatsapp","Observe and troubleshoot WhatsApp in Kapso: debug message delivery, inspect webhook deliveries/retries, triage API errors, and run health checks. Use when investigating production issues, message failures, or webhook delivery problems."
"og-image-design","Open Graph and social sharing image design with platform specs, text placement, and branding. Covers OG meta tags, Twitter cards, LinkedIn previews, and dynamic generation. Use for: social sharing images, blog thumbnails, link previews, social cards. Triggers: og image, open graph, social sharing image, twitter card, social card, link preview image, og meta, sharing preview, social thumbnail, meta image, og:image, twitter:image, linkedin preview"
"og-image-design","Open Graph and social sharing image design with platform specs, text placement, and branding. Covers OG meta tags, Twitter cards, LinkedIn previews, and dynamic generation. Use for: social sharing images, blog thumbnails, link previews, social cards. Triggers: og image, open graph, social sharing image, twitter card, social card, link preview image, og meta, sharing preview, social thumbnail, meta image, og:image, twitter:image, linkedin preview"
"parallel-debugging","Parallel Debugging"
"plannotator","plannotator — Interactive Plan & Diff Review"
"postgresql-code-review","PostgreSQL Code Review Assistant"
"power-bi-model-design-review","Power BI Data Model Design Review"
"production-code-audit","Autonomously deep-scan entire codebase line-by-line, understand architecture and patterns, then systematically transform it to production-grade, corporate-level professional quality with optimizations"
"prompt-library","Curated collection of high-quality prompts for various use cases. Includes role-based prompts, task-specific templates, and prompt refinement techniques. Use when user needs prompt templates, role-play prompts, or ready-to-use prompt examples for coding, writing, analysis, or creative tasks."
"receiving-code-review","Code Review Reception"
"receiving-code-review","Code Review Reception"
"refactor","Refactor"
"refactor-method-complexity-reduce","Refactor Method to Reduce Cognitive Complexity"
"refactor-plan","Refactor Plan"
"requesting-code-review","Requesting Code Review"
"requesting-code-review","Requesting Code Review"
"review-and-refactor",""
"reviewing-oracle-to-postgres-migration","Oracle-to-PostgreSQL Database Migration"
"ruby-mcp-server-generator","Code review for #{language} with focus on #{focus}"
"second-opinion","Runs external LLM code reviews (OpenAI Codex or Google Gemini CLI) on uncommitted changes, branch diffs, or specific commits. Use when the user asks for a second opinion, external review, codex review, gemini review, or mentions /second-opinion."
"security-review","Security Review Skill"
"self-improvement","Captures learnings, errors, and corrections to enable continuous improvement. Use when: (1) A command or operation fails unexpectedly, (2) User corrects Claude ('No, that's wrong...', 'Actually...'), (3) User requests a capability that doesn't exist, (4) An external API or tool fails, (5) Claude realizes its knowledge is outdated or incorrect, (6) A better approach is discovered for a recurring task. Also review learnings before major tasks. For CI-only/headless learning capture, use self-improvement-ci."
"self-improvement-ci","CI-only self-improvement workflow using gh-aw (GitHub Agentic Workflows). Captures recurring failure patterns and quality signals from pull request checks, emits structured learning candidates, and proposes durable prevention rules without interactive prompts. Use when: you want automated learning capture in CI/headless pipelines."
"skill-improver","Iteratively reviews and fixes Claude Code skill quality issues until they meet standards. Runs automated fix-review cycles using the skill-reviewer agent. Use to fix skill quality issues, improve skill descriptions, run automated skill review loops, or iteratively refine a skill. Triggers on 'fix my skill', 'improve skill quality', 'skill improvement loop'. NOT for one-time reviews—use /skill-reviewer directly."
"sql-code-review","SQL Code Review"
"swiftui-expert-skill","Write, review, or improve SwiftUI code following best practices for state management, view composition, performance, modern APIs, Swift concurrency, and iOS 26+ Liquid Glass adoption. Use when building new SwiftUI features, refactoring existing views, reviewing code quality, or adopting modern SwiftUI patterns."
"systematic-debugging","Systematic Debugging"
"systematic-debugging","Systematic Debugging"
"talking-head-production","Talking head video production with AI avatars, lipsync, and voiceover. Covers portrait requirements, audio quality, OmniHuman, PixVerse lipsync, Dia TTS. Use for: spokesperson videos, course content, social media, presentations, demos. Triggers: talking head, avatar video, lipsync, lip sync, ai spokesperson, virtual presenter, ai presenter, omnihuman, talking avatar, video presenter, ai talking head, presenter video, ai face video"
"talking-head-production","Talking head video production with AI avatars, lipsync, and voiceover. Covers portrait requirements, audio quality, OmniHuman, PixVerse lipsync, Dia TTS. Use for: spokesperson videos, course content, social media, presentations, demos. Triggers: talking head, avatar video, lipsync, lip sync, ai spokesperson, virtual presenter, ai presenter, omnihuman, talking avatar, video presenter, ai talking head, presenter video, ai face video"
"team-collaboration-issue","You are a GitHub issue resolution expert specializing in systematic bug investigation, feature implementation, and collaborative development workflows. Your expertise spans issue triage, root cause an"
"threat-modeling-expert","Expert in threat modeling methodologies, security architecture review, and risk assessment. Masters STRIDE, PASTA, attack trees, and security requirement extraction. Use for security architecture reviews, threat identification, and secure-by-design planning."
"ui-ux-pro-max","UI/UX design intelligence. 50 styles, 21 palettes, 50 font pairings, 20 charts, 9 stacks (React, Next.js, Vue, Svelte, SwiftUI, React Native, Flutter, Tailwind, shadcn/ui). Actions: plan, build, create, design, implement, review, fix, improve, optimize, enhance, refactor, check UI/UX code. Projects: website, landing page, dashboard, admin panel, e-commerce, SaaS, portfolio, blog, mobile app, .html, .tsx, .vue, .svelte. Elements: button, modal, navbar, sidebar, card, table, form, chart. Styles: glassmorphism, claymorphism, minimalism, brutalism, neumorphism, bento grid, dark mode, responsive, skeuomorphism, flat design. Topics: color palette, accessibility, animation, layout, typography, font pairing, spacing, hover, shadow, gradient. Integrations: shadcn/ui MCP for component search and examples."
"vercel-deploy-claimable","Deploy applications and websites to Vercel. Use this skill when the user requests deployment actions such as 'Deploy my app', 'Deploy this to production', 'Create a preview deployment', 'Deploy and give me the link', or 'Push this live'. No authentication required - returns preview URL and claimable deployment link."
"video-prompting-guide","Best practices and techniques for writing effective AI video generation prompts. Covers: Veo, Seedance, Wan, Grok, Kling, Runway, Pika, Sora prompting strategies. Learn: shot types, camera movements, lighting, pacing, style keywords, negative prompts. Use for: improving video quality, getting consistent results, professional video prompts. Triggers: video prompt, how to prompt video, veo prompts, video generation tips, better ai video, video prompt engineering, video prompt guide, video prompt template, ai video tips, video prompt best practices, video prompt examples, cinematography prompts"
"video-prompting-guide","Best practices and techniques for writing effective AI video generation prompts. Covers: Veo, Seedance, Wan, Grok, Kling, Runway, Pika, Sora prompting strategies. Learn: shot types, camera movements, lighting, pacing, style keywords, negative prompts. Use for: improving video quality, getting consistent results, professional video prompts. Triggers: video prompt, how to prompt video, veo prompts, video generation tips, better ai video, video prompt engineering, video prompt guide, video prompt template, ai video tips, video prompt best practices, video prompt examples, cinematography prompts"
"voice-agents","Voice agents represent the frontier of AI interaction - humans speaking naturally with AI systems. The challenge isn't just speech recognition and synthesis, it's achieving natural conversation flow with sub-800ms latency while handling interruptions, background noise, and emotional nuance.  This skill covers two architectures: speech-to-speech (OpenAI Realtime API, lowest latency, most natural) and pipeline (STT→LLM→TTS, more control, easier to debug). Key insight: latency is the constraint. Hu"
"web-design-guidelines","Web Interface Guidelines Review"
"web-design-reviewer","Web Design Reviewer"
